{
  "seqnum": 1,
  "event": "snapshot",
  "channel": "balances",
  "balances": [
    {
      "currency": "BTC",
      "balance": 1.0,
      "available": 1.0,
      "balance_local": 1.0,
      "available_local": 1.0,
      "rate": 72525.0
    }
  ],
  "total_available_local": 1.0,
  "total_balance_local": 1.0
}
